date,time,description,location,category
2025-01-09,22:00,"🌌 If you’re interested in an introductory session to observe the night sky & astronomy activities, JNP are hosting","Jawaharlal Nehru Planetarium, Sankey Road",Workshop
2025-01-09,20:00,Screening of director Gus Van Sant's Indie melodrama movie a three-course dinner by chef Rhea Aaron,"Courtyard, Shantinagar",Theatre
2025-01-09,19:00,"If you like psychedelic sounds, acid textures & mind-bending techno, DJ Sunju Hargun & Ashna Malik are performing","Social, Indiranagar",Music
2025-01-09,19:45,"If you want to listen to Tamil Rap & Hip-Hop, Isai are performing    Until tomorrow 👋","Don't Tell Mama, HSR Layout",Music
2025-01-10,19:00,"️🪑🖼️ An innovative showcase exploring craft practices & materials in new directions, with a curated collection of lighting, seating, art & more with Kaash","Kaash, Langford Town",Workshop
2025-01-10,18:00,Screening of a documentary fostering awareness about the Nilgiris Biosphere Reserve & its enduring relationship with people & nature with Sandesh Kadur,Courtyard Koota,Film Screening
2025-01-10,18:30,"If you want to listen to a soulful collection of compositions & explore the fluid & evolving concept of 'home', pianist Aman Mahajan is performing","Natallia Piano Studio, Hulimavu",Music
2025-01-10,16:00,"A Chef's table collab to try unique desserts with locally sourced ingredients from the Andamans, Sakaré! with Salt & Pepper are hosting","Salt & Pepper Kitchen, Primrose Road",Food/Drink
2025-01-10,10:00,"🥕 If you’re interested in procuring fresh produce from a farmer’s market alongside performances & workshops, Soma are hosting",Shankaraa Foundation,Workshop
2025-01-10,11:00,"️🌱🌍 If you're interested in Climate Storytelling, where the art of communication meets climate action, The Climate Party are hosting","BHIVE Workspace, MG Road",Other
2025-01-10,10:00,"️ If you're interested in the art of designing & printing your own 3D creations, Mohammed Talha Adil is hosting","MakerSpace, CMR University, Lakeside Campus",Workshop
2025-01-10,14:00,"If you want to learn to protect your plants naturally with effective, chemical-free pest control techniques, Atlantis Sanctuary are hosting","Atlantis Sanctuary, Kensington Road",Workshop
2025-01-10,8:00,"‍♀️🚶 If you’re interested in a heritage walk to Tipu Sultan’s summer palace & a visit to his last armory, Bengaluru by Foot are hosting",Chamarajpet,Fitness/Wellness
2025-01-10,9:30,A guided tour to look at private colelction of vintage & classic automobile along with the restoration workshop with Classic Chase,Classic Chase,Workshop
2025-01-10,11:30,"️‍♀️ If you're interested in a 2-day workshop with curated exercises inspired by Kalaripayattu, The Kalari Movement are hosting ",Dhurii Academy of Arts,Workshop
2025-01-10,11:00,"️ An insightful session on mediation, where global & Indian perspectives converge with Hiram Chodosh & Sriram Panchu    Until tomorrow 👋","BIC, Domlur",Fitness/Wellness
2025-01-11,10:00,"‍⚕️ A one-of-a-kind workshop where therapists decode neurodivergence, concentration & procrastination like never before with Kaha Mind ","Kaha Mind, CMH Road",Workshop
2025-01-11,17:00,"If you're interested in a discussion & book launch of 'The Delhi Model', author Jasmine Shah is hosting","BIC, Domlur",Talk
2025-01-11,10:00,"If you’re interested in an analog photography workshop & develop your own B&W film, photographer Hellmuth Conz is hosting",Cooke Town,Workshop
2025-01-11,11:00,"If you're interested in an immersive & interactive perfume-making experience under the guidance of legacy perfumers, perfumer Kareem is hosting","Babylonia, Koramangala",Workshop
2025-01-11,11:30,"️ A lecture exploring public engagement in conserving India’s plant diversity, vital to ecosystems, climate resilience, health & cultur","BIC, Domlur",Talk
2025-01-11,16:00,"An event for artists to share their creative process with an intimate audience, exploring the journey of a song from inspiration to release with WIP","Pizza Express, Koramangala",Other
2025-01-11,16:00,"If you're interested in a talk exploring the large scale impact of Kepler's law in Astronomy, JNP are hosting","Jawaharlal Nehru Planetarium, Sankey Road",Talk
2025-01-11,18:00,"Artists Joana & Sjahin collab with Amith Nadig on Carnatic flute & Aman Mahajan on piano, for a special crossover experience of their music","The Blue Room, Jayanagar",Music
2025-01-11,14:00,"🫳 If you're interested in a hands-on pottery experience to create pottery & other clay-based artworks, Maya's Pottery are hosting    Have a great weekend ahead ❤️",Mayas Pottery,Workshop
2025-01-13,18:30,"If you’re interested in a Nursery Rhymes themed social puzzle solving hangout, Puzzled Pint are hosting","Secret Story Bar & Kitchen, Indiranagar",Meetup/Social
2025-01-13,12:00,"Explore the intricacies of punch needle techniques, thread selection & fabric choices to create stunning textured designs with StoryZone    Until tomorrow 👋","Story Zone Studio, HSR",Workshop
2025-01-14,18:30,"🐅 A film takes viewers behind the scenes of India’s ambitious conservation journey, revealing untold stories of triumphs, setbacks & compromises","BIC, Domlur",Film Screening
2025-01-14,14:30,"️👩‍⚕️ A discussion on how Many-Body physics is paving the way for the next 100 years of computation, with Quantum Physicist Vedika Khemani ","Chandrasekhar Auditorium, ICTS, Uttarahalli",Talk
2025-01-14,18:30,"A gathering celebrating the simplicity & depth of storytelling, offering a chance to connect through shared narratives & perspectives with iDare","Native Table At Go Native, Lavelle Road",Meetup/Social
2025-01-14,19:30,An interactive murder mystery play about a woman's death in a bar & the hunt to find the murderer with audience’s involvement    Until tomorrow 👋,"Ranga Shankara, JP Nagar",Theatre
2025-01-15,21:00,"If you want to listen to Afro, Rap & more, artist Uzi is performing","Watson's, Indiranagar",Music
2025-01-15,6:00,"‍♂️🏃‍♀️ If you're interested in an easy run with strength training, Adidas Runner’s HSR chapter are hosting",HSR Stadium,Fitness/Wellness
2025-01-15,14:00,🐅 Screening of a documentary fostering awareness about the Nilgiris Biosphere Reserve & its enduring relationship with people & nature    Until tomorrow 👋,"Mount Carmel College Autonomous, Vasanth Nagar",Film Screening
2025-01-16,20:00,"If you like bar takeovers, mixologist Vineeth Krishnan from AER Yacht Club, Mumbai is hosting","Copitas, Four Seasons Hotel, Ganganagar",Food/Drink
2025-01-16,10:00,"‍💻 If you're interested in a Revit interface & tools workshop, Architect Sabby Mittra is hosting","MakerSpace, CMR University, Lakeside Campus",Workshop
2025-01-16,19:30,"A culmination of multimedia elements including song, dance, puppetry & clowning to celebrate the legacy of female performers in Kannada theatre","Ranga Shankara, JP Nagar",Theatre
2025-01-16,20:00,"If you want to listen to new-age indie pop music, artist Rohh is performing","Bira 91 Taproom, Koramangala",Music
2025-01-16,18:30,Screening of German director Birgit Möller's romcom drama,"Suchitra Cinema and Cultural Academy, Banashankari",Theatre
2025-01-16,19:30,"A genre-defying showcase blending movement, voicework, spoken word & theatrical traditions with slam poet Nupur Azadi   ","Jagriti Theatre, Whitefield",Theatre
2025-01-16,19:30,"If you like board games, specifically Mafia - Games Lab are hosting    Until tomorrow 👋","Café du L'Amour, Koramanagala",Other
2025-01-17,20:00,"If you like bar takeovers: the head bartender from Jewel of the South, New Orleans  is hosting  (ZLB 23, The Leela Palace - 08:00 PM)","ranked 34 on World’s 50 Best Bars) is hosting https://bit.ly/4jcP1Ah (ZLB 23, The Leela Palace",Food/Drink
2025-01-17,12:00,"🏋️‍♂️ If you're interested in a vegan market to discover new brands alongside yoga sessions, panel events & cooking demos, Namu Recommends are hosting","Chamara Vajra, Jayamahal",Talk
2025-01-17,15:30,"‍♀️🚶‍♂️🌳 A forest bathing experience with a five-sense nature trail of sight, touch, feel, taste & smell as part of BLR Design Week",Design Farm,Other
2025-01-17,16:30,"‍♀️🪐 If you're interested in an introductory workshop to the basics of Angel Poi spinning with flow exercises, instructor Shraddha is hosting",Copper + Cloves Studio,Workshop
2025-01-17,14:00,"If you're interested in learning the basics of sewing to create fun drawstring Fish Pouches, PCL are hosting",Paper Crane Lab,Workshop
2025-01-17,10:30,"️‍♀️🏋️‍♂️🥗 If you're interested in a dynamic strength & conditioning workout followed by brunch, Troop are hosting","Troop HQ, Domlur",Fitness/Wellness
2025-01-17,11:00,"A showcase of comics, cosplay, collectible merch, toys, immersive fan experiences, gaming & more with Comic Con","KTPO, Whitefield",Theatre
2025-01-17,17:00,"️ If you're interested in a lecture on Quantum Astrophysics in honor of Prof. Vishveshwara, founder of JNP, astrophysicist Roger Blandford are hosting","Christ University, Hosur Main Road",Talk
2025-01-17,20:00,"If you’re interested in trying vino cocktails, sommelier Prithvi Nagpal & bartender Vimal Raj are hosting","Trippy Goat, Cunningham Road",Food/Drink
2025-01-17,14:30,"🫳 If you're interested in making exquisite Egg caddies using clay, Goak Ceramics are hosting",GOAK Ceramics,Workshop
2025-01-17,16:30,Screening of director Ernst Lubitsch's romcom,"Underline Center, Indiranagar",Film Screening
2025-01-17,17:00,"If you're interested in a book discussion of the book 'In Pursuit of Freedom', author Pradeep Damodaran & Subir Dey are hosting","Champaca Book Store, Vasantnagar",Talk
2025-01-17,15:30,"A vibrant celebration of theatre, acting & life itself, finding humor & meaning in the absurdity of two dead men yearning for their final curtain call","Ranga Shankara, JP Nagar",Theatre
2025-01-17,15:00,"If you're interested in testing your skills with timeless board games & exciting team challenges, Board Busters are hosting    Until tomorrow 👋","Smoke House Deli, Lavelle Road",Other
2025-01-18,12:30,"🍶 If you want to indulge in vegetarian spicy ramen, tteokbokki & refreshing soju cocktails, Chef Simran from Koreatoindia is hosting","KoreatoIndia, JP Nagar 3rd Phase",Food/Drink
2025-01-18,9:30,🦢 A workshop to see how the art of origami has applications in the fields of science & technology with Scientist Krishna Thyagarjan,"Science Gallery, Ganganagar",Workshop
2025-01-18,8:30,"️‍♀️🏋️‍♀️ If you want to discover the ancient art of strength & endurance training using traditional tools like the Gada & Mudgar, Tagda Raho are hosting","Tagda Raho, Ulsoor",Fitness/Wellness
2025-01-18,11:00,"🍪 If you want to enjoy fab food, fun vibes & community feels this Sunday, Mokosh Bakehouse, Loafer & Co. & more are hosting",No.58 Lazar road opposite BSNL in Cooke Town.,Food/Drink
2025-01-18,15:00,"‍♀️👯‍♂️ For women wanting to boost their fitness & confidence with a 90-minute pole workshop, instructor Azdah is hosting ","Studio Azdah, Indiranagar",Workshop
2025-01-18,17:00,Screening of Japanese director Tomu Uchida's romantic drama,"Untitled Arts Foundation, JP Nagar",Theatre
2025-01-18,6:30,"🚵‍♀️ If you’re interested in a countryside bike ride in and around Hennur, Pedal in Tandem are hosting",Snoopy Paws Cafe,Fitness/Wellness
2025-01-18,8:00,🚶‍♀️🚶‍♂️ An enriching tree walk to discover fascinating stories about Bengaluru’s trees & explore exciting citizen science initiatives with Terrum & EFI,"GKVK Campus, Jakkur",Fitness/Wellness
2025-01-18,16:00,️🛰️ If you're interested in an illustrated lecture series on the Parker solar probe & Aditya L1: Director of JNP Guruprasad is hosting,"Jawaharlal Nehru Planetarium, Sankey Road",Talk
2025-01-18,15:30,"This timeless tale by Girish Karnad delves into the complexities of human relationships & moral dilemmas, in a richly layered narrative","Ranga Shankara, JP Nagar",Market/Popup
2025-01-18,7:15,"‍♀️🦮🐾 If you want to take part in a 2KM Dogathon with your pets followed by some games & treats for them, HUFT are hosting  ","Bhartiya Mall of Bengaluru, Thanisandra Main Road",Other
2025-01-18,19:00,️🪄 Open-air screening of director Chris Columbus's fantasy adventure film    Have a great weekend ♥️,"Nexus Shantiniketan Mall, Whitefield",Film Screening
2025-01-20,12:30,"If you want to experience Rajasthan's timeless hospitality & savor beloved recipes, Momo Cafe are hosting",MoMo Café - Courtyard by Marriott,Food/Drink
2025-01-20,19:45,Screening of director Luis Buñuel's comedy drama,"Underline Center, Indiranagar",Theatre
2025-01-20,18:30,"A conversation on the book 'Rama Bhima Soma', a compelling exploration of Karnataka’s rich cultural & political history with author Srikar Raghavan","BIC, Domlur",Talk
2025-01-20,19:30,"A poignant tale celebrating the power of heritage, resilience & newfound purpose of a bond between a granddaughter & her Aajo    Until tomorrow 👋","Ranga Shankara, JP Nagar",Theatre
2025-01-21,12:00,"If you want to savor Purani Dilli's flavors on your plate, Karim's are hosting","Feast, Prestige Shantiniketan Hoodi, Whitefield",Food/Drink
2025-01-21,18:30,"If you want to hear excerpts from the memoir 'The Grammar of My Body', poet Abhishek Anicca is hosting","345, Cooke Town",Other
2025-01-21,11:00,"If you want to look at & shop for designer jewelry in an annual showcase, Art Karat are hosting    Until tomorrow 👋",Raintree,Market/Popup
2025-01-22,19:00,"If you want to listen to classical Indian folk & music played on Mohan Veena, Grammy award winners Pt. Vishwa Mohan Bhatt & Ricky Kej are performing ","Prestige Centre for Performing Arts, Konanakunte",Music
2025-01-22,16:00,"🎙️ If you're interested in a hands-on experience on the sun, moon & the Planets an intro to the night sky, JNP are hosting","Jawaharlal Nehru Planetarium, Sankey Road",Other
2025-01-22,6:00,"‍♀️🏃‍♂️ If you're interested in a beginner-friendly run, Adidas Runner’s Indiranagar chapter is hosting    *Later in the week:*","Adidas Store, Indiranagar",Fitness/Wellness
2025-01-23,9:00,"🌸🇮🇳 If you want to check out the ongoing gardening flower show  at Lalbagh this Republic Eve, the Department of Horticulture are hosting",Lalbagh,Other
2025-01-23,20:00,"🍹 If you like bar takeovers, mixologists Deke & Princess from Allegory, Washington  are hosting  (ZLB 23, The Leela Palace - 08:00 PM)","Ranked No. 23 on North America’s Best Bars 2024) are hosting https://bit.ly/4h7JRDW (ZLB 23, The Leela Palace",Food/Drink
2025-01-23,19:00,"🪴 An immersive one-of-a-kind concert featuring a fusion of music, nature & technology, with Masterplants Orchestra from Denmark","Treehouse, Indiranagar",Music
2025-01-23,19:30,"If you want to enjoy the flavors of Persian cuisine, Chef Nasrin is hosting","Tijouri, The Atria Hotel, Palace Road",Food/Drink
2025-01-23,21:30,"🎻 If you want to listen to intricate rhythms of Indian Carnatic music with the fluid spontaneity of European jazz, Advaita Crescendo are performing",Windmills,Music
2025-01-23,18:00,"️🌍 A talk delving into strategies that harmonize the built environment with nature, ensuring a resilient & sustainable future with Climate Connect","Samagata Foundation, Church Street",Talk
2025-01-23,20:30,"🪕 If you want to listen to contemporary pop with the rich heritage of Carnatic music, artist Hrishi is performing","Fandom at Gilly's Redefined, Koramanagla",Music
2025-01-23,19:00,Open air screening of director Wes Anderson's comedy drama,"Chapter 6, Koramangala",Theatre
2025-01-23,14:00,"A 3 day theatre festival to immerse in the soul of rich, Karnataka based Folklore, lively Street Plays & carnival delicacies with Ventures Theatre","St. John's Auditorium, Koramangala",Theatre
2025-01-23,20:00,"If you want to listen to Hip Hop, artists Reflected Ray, Ritz & Fraape are performing","Social, Church Street",Music
2025-01-23,19:30,A gripping sci-fi play about emotional attachments formed in the digital world & the line between fantasy & ethical behavior  ,"Ranga Shankara, JP Nagar",Theatre
2025-01-23,12:30,"🍷 If you want to enjoy a brunch with scrumptious vegetarian Korean food & fine wine, koreatoindia X Fratelli are hosting    Until tomorrow 👋","Pour Room, Koramangala",Food/Drink
2025-01-24,18:30,‍♀️🚶‍♂️🥃 Brand Ambassdors Billy Kingston & Keir Williams take you on a memorable Whiskey Crawl experience through SoBa's finest & most iconic pub scenes,"1522, JP Nagar",Food/Drink
2025-01-24,10:00,"🟦 If you're interested in a Cyanotype workshop , Praxis Techne are hosting  (Praxis Technē, Hebbal - 10:00 AM)","a photographic printing process that produces a blue print), Praxis Techne are hosting https://bit.ly/3POBbX3 (Praxis Technē, Hebbal",Workshop
2025-01-24,11:30,🔭 A 4 lecture series to learn about 'History of Ancient Indian Astronomy' with Dr. B.S. Shylaja,"Jawaharlal Nehru Planetarium, Sankey Road",Talk
2025-01-24,15:00,"🪻 If you want to volunteer to find & identify as many species of plants, animals & other organisms, AF Bangalore & The Naturalist school are hosting","Alliance Française, Vasantnagar",Other
2025-01-24,19:30,"If you want to listen to listen to timeless works of Bach, pianist Natallia Kapylova is performing","Jagriti Theatre, Whitefield",Music
2025-01-24,12:30,🐝🎙️ A talk delving into flight-enabled insects & understanding the mechanisms offering insights into how insects manage agility & efficiency,"Science Gallery, Ganganagar",Talk
2025-01-24,18:00,"‍♀️🍄 An immersive, tranquil evening practicing Yin Yoga with the soothing properties of Reishi mushroom extract with Nuvedo","Orange Arc Community Studio, Cooke Town",Fitness/Wellness
2025-01-24,8:00,"If you want to learn how to cycle as an adult, Pedal in Tandem are teaching",Pedal In Tandem,Fitness/Wellness
2025-01-24,14:00,"If you're interested in a yarn knit/crochet/spin meetup over coffee, Calico Yarn Studio are hosting","Cafe Azzure, MG Road",Meetup/Social
2025-01-24,13:00,"If you’re interested in solving different types of puzzles, Playful Pursuits are hosting   ",Courtyard Koota,Theatre
2025-01-24,6:00,"‍♀️🏃‍♂️ If you’re interested in a beginner-friendly 5k run for a cause, FTS Foundation are hosting","Guanella Preethi Nivas, Hennur Gardens",Fitness/Wellness
2025-01-24,18:30,"An intimate session to listen to stories & compositions in a combined singer-songwriter set with musicians Michael Dias, Frizzell D'Souza & more ","Bangalore Creative Circus, Yeshwanthapur",Music
2025-01-24,19:00,️ Open air screening of director Roger Michell's romcom    Until tomorrow 👋,"Forum, South Bangalore",Film Screening
2025-01-25,17:00,"Screening of 3 feminist short films by The Third Eye, a feminist think tank & pedagogical arts platform at IIHS ","IIHS, Bengaluru City Campus, Sadashiva Nagar",Film Screening
2025-01-25,18:30,"🎺 If you want to listen to intricate rhythms of Indian Carnatic music with the fluid spontaneity of European jazz, Advaita Crescendo are performing","Indian Music Experience Museum, JP Nagar 7th Phase",Music
2025-01-25,11:00,"🥾 If you want to learn to craft paper to make legendary sneaker models in a hands-on immersive workshop, illustrator Saksham is hosting","Ajji House by Subko, Shanti Nagar",Workshop
2025-01-25,17:00,️ Screening of director Mohammad Reza Aslani's thriller documentary drama,"Untitled Arts Foundation, JP Nagar",Theatre
2025-01-25,12:00,"✍️ If you're interested to get a copy of the book 'Nagrota: Under Siege' signed, author Bhaavna Arora is hosting","Atta Galatta, Indiranagar",Literature
2025-01-25,5:30,"‍♀️🏃‍♂️ If you're interested in the monthly, beginner-friendly 5km run, Bhaago India are hosting","Sobha Lavender, Bellandur",Fitness/Wellness
2025-01-25,8:00,"✍️ If you're interested in an enchanting experience to observe & sketch the nesting Painted Storks & their chicks, Green Panther Club are hosting",Kokkare Belluru Bird Sanctuary,Other
2025-01-25,9:45,"If you want to engage in a workshop to discuss books & take part in themed activities based on politics & culture, historian Geetha is hosting","Champaca Book Store, Vasantnagar",Workshop
2025-01-25,15:30,"3 men, 3 benches & yet not enough space – a powerful drama exploring human relationship with space, delving into questions of ownership & more","Jagriti Theatre, Whitefield",Theatre
2025-01-25,14:00,"🧣📿 A signature pop-up experience blending music, art & style with a line-up of DJ's & selectors alongside curated products with Disco>ery ","Pebble, Bellary Road",Workshop
2025-01-25,11:45,"If you want to celebrate the iconic flavors, lively streets & rich culture of Chandni Chowk in your city, Vivanta By Taj are hosting","Vivanta By Taj, Whitefield",Other
2025-01-25,11:00,"🧣 If you're interested in a hands-on workshop to create an organic cotton stole using natural dyes, Uru Brewpark are hosting","Uru Brewpark, JP Nagar",Workshop
2025-01-25,20:00,"🎧 If you like Melodic House, Techno & underground music DJ's Genesi & Alchemiah are performing",Kitty Ko,Music
2025-01-25,12:00,"If you’re interested in playing a beginner-friendly game of Dungeons & Dragons, ReRoll Board Games are hosting    Have a great weekend ♥️","Underline Center, Indiranagar",Theatre
2025-01-27,11:00,"‍🎨🖼️ If you're interested in an all-female showcase of artworks, Kynkyny Art Gallery are hosting","KYNKYNY Art Gallery, Infantry Road",Art Exhibition
2025-01-27,19:00,"If you're interested in a board game night, Cafe Plume are hosting","Cafe Plume, Indiranagar",Other
2025-01-27,19:45,Screening of director Shūji Terayama's  coming-of-age experimental artistic surrealistic fantasy autobiographical drama,"Underline Center, Indiranagar",Theatre
2025-01-27,17:30,️ An engaging session on the current landscape of arts funding in India & to gain valuable tips for securing funding with Shraddha Jadhav from MAP,"Museum of Art & Photography, Kasturba Road",Other
2025-01-27,18:30,"️ If you're interested in a session inspired by the book 'Transformed By India', Author Stephen Huyler with journo Sandhya Mendonca are hosting    **Later in the week:**","BIC, Domlur",Literature
2025-01-28,19:00,"💟 If you're interested in a beginner-friendly workshop to design & create custom cookie cutters, PCL are hosting",Paper Crane Lab,Workshop
2025-01-28,18:00,"If you want to participate in a global puzzling event to celebrate International Puzzle Day, Playful Pursuits & JPAI are hosting","Underline Center, Indiranagar",Theatre
2025-01-28,12:00,"If you want to watch a series of short films, Bengaluru International Short Film Festival are hosting","J N Tata Auditorium, Malleswaram",Film Screening
2025-01-28,19:30,"If you want to savor the sounds, smell & tastes of Bangalore with a community of cycling enthusiasts: Pedal In Tandem are hosting",Pedal In Tandem,Fitness/Wellness
2025-01-28,19:00,"If you're interested in a bar Takeover & a masterclass to learn to make Gin cocktails, mixologist Ishrat Kaur is hosting  , Indiranagar - 07:00 PM)","The Drawing Room (Smoke House Deli), Indiranagar",Food/Drink
2025-01-28,19:30,"🧘‍♀️🧘‍♂️ If you're interested in an intention setting, sound healing meditation with Tibetan bowls, gong & Vibrations, facilitator Tanmayi is hosting","Red Brick Studio, Indiranagar",Fitness/Wellness
2025-01-28,18:30,"️ A talk delving into the Chola dynasty's remarkable blend of devotion, artistry & resourcefulness with Prof. Vidya Dehejia","BIC, Domlur",Talk
2025-01-28,10:00,"️🖊️ If you're interested to learn freestyle calligraphy, artist Chinmay Hegde is hosting    Until tomorrow 👋","PES University, BSK III Stage",Workshop
2025-01-29,21:00,"If you want to listen to House & Disco, Crab Culture are performing","Watson's, Indiranagar",Music
2025-01-29,11:00,🎞️ A photography exhibit celebrating South Indian Cinema & cultural heritage inspired by the childhood of photographer Clare Arni at Gallery Sumukha,Gallery Sumukha,Art Exhibition
2025-01-29,20:00,"🍳 If you like bar takeovers & midnight brekkies, mixologists Akshit, Prithvi, & Vimal from Boilermaker, Goa are hosting","Dali & Gala, Museum Road",Food/Drink
2025-01-29,17:00,"🍷 If you want to listen to 2000s R & B & Hip Hop while sipping on fine wine at W.I.P, DJ Kristel Ann is hosting","Wine in Progress, Shanti Nagar",Music
2025-01-29,18:00,"If you're interested in a discussion on the book 'Airplane Mode', author Shahnaz Habib & Rohini Mohan are hosting","Champaca Book Store, Vasantnagar",Talk
2025-01-29,6:00,"‍♀️🏃‍♂️ If you're interested in an easy Circuit run, Adidas Runners’s HSR chapter are hosting",HSR Stadium,Fitness/Wellness
2025-01-29,18:30,"🚲 A hybrid film blending fact and fiction follows Mahesh, a migrant worker reliving his epic lockdown journey, seeking freedom from alienation","BIC, Domlur",Film Screening
2025-01-30,20:00,"If you like bar takeovers, mixologist Atsushi Suzuki from The Bellwood, Tokyo  is hosting  (Muro - 08:00 PM)",ranked #34 in Asia’s 50 Best Bars 2024) is hosting https://bit.ly/42zpf37 (Muro,Food/Drink
2025-01-30,12:30,"If you want to taste bold flavors of Naga cuisine, Chef Alistair Lethorn is hosting",The Park,Food/Drink
2025-01-30,19:00,"If you want to watch solo performances by drumming legends from India & around the world, artists Peter Szendofi, Ranjit Barot & more are performing","Chowdiah Memorial Hall, Malleswaram",Theatre
