date,time,description,location,category
2024-07-05,16:30,"🎽 If you're interested in learning how to use bleach on paper or fabric to make artwork, artist Shruti Jain is hosting",Tsala studio,Workshop
2024-07-05,19:00,"🎵 A PJ party with music, drinks & a 2010's pop themed Karaoke sesh with Sunflower Tape Machine","The Raft, Koramanagala",Music
2024-07-05,19:30,"If you're interested in learning the street style dance origination from punking, artist Theertha is hosting","ARDSIndia, New Tippasandra,",Dance
2024-07-05,18:30,"🌈 If you ever wanted to explore the parallels between the diverse world of mushrooms & the LGBTQ+ community, Mycodyke & Nuvedo are hosting","Atta Galatta, Indiranagar",Other
2024-07-05,19:00,Screening of a film exploring the universalist idea in India’s current political climate by legendary documentary maker Anand Patwardhan,"Museum of Art & Photography, Kasturba Road",Film Screening
2024-07-05,17:00,"A discussion of 'Biopeculiar' a book of speculative short stories with author Gigi Ganguly, Vinayak Varma & Radhika Timbadia","Champaca Book Store, Vasantnagar",Talk
2024-07-05,13:00,"👖 If you're interested in repairing your garments by yourself & reduce waste, EcoDhaga are hosting","EcoDhaga, Koramangala",Workshop
2024-07-05,11:00,🕵️ A silent reading session & discussion around crime fiction books from BIC’s library,"BIC, Domlur",Talk
2024-07-05,9:30,"If you're interested in a two day  flashcamp to learn how to play tennis, Amogha Sports Tennis Academy are hosting","Amogha Sports Tennis Academy, Palace Road",Theatre
2024-07-05,8:00,"If you're interested in learning the basics of the ancient martial art form of Kalaripayatt, Urban Kalari are hosting","Lateralus Studio, Queens Road",Workshop
2024-07-05,18:30,️🇯🇵 Screening of Japanese director Mikio Naruse's melodrama,"Untitled Arts Foundation, JP Nagar",Theatre
2024-07-05,11:00,"If you're interested in learning more about Matcha & try Matcha Latte, Sakura Matcha Bar are hosting","Roja Studios, Hegde Nagar",Food/Drink
2024-07-05,16:00,"If you're interested in a silent reading circle & discussion, Aastha Sharma is hosting","Fatty Bao, Indiranagar",Talk
2024-07-05,19:00,"If you like progressive house music, Miami based DJ Stan Kolev is performing     Until tomorrow 👋","Sunburn Union, Koramangala",Music
2024-07-06,12:00,🌭 A Sunday brunch with bubblies & grubs with Chef Adrial Branco from Goa,Bar Spirit Forward,Fitness/Wellness
2024-07-06,12:00,"🥪 If you’re interested in a sandwich popup featuring a secret French sauce, Nari & Kage are hosting","Nari and Kāge, Koramangala",Market/Popup
2024-07-06,16:00,India's theatrical cult phenomenon based on Eve Ensler's episodic play in its 20th year,"Atta Galatta, Indiranagar",Theatre
2024-07-06,17:00,"👖 If you're interested in learning to embroider a pair of plain denims, artist Kavitha is hosting","Atta Galatta, Indiranagar",Workshop
2024-07-06,18:30,"‍♀️ If you want to watch Nrityanidhi style of dance, inspired by Sufi music & Kathak choreography: Nrityanidhi Troupe are performing","BIC, Domlur",Music
2024-07-06,14:30,Screening of Studio Ghibli director Hayao Miyazaki's animated fantasy,"Starbucks, Bangalore",Film Screening
2024-07-06,14:30,"️ If you're interested in learning the artistic side of animation & its role in environmental advocacy, animators Nirupa, Fabian & more are hosting","BIC, Domlur",Workshop
2024-07-06,11:00,"🍒 If you’re interested in procuring fresh produce from a farmers market, BCC are hosting","Bangalore Creative Circus, Yeshwanthapur",Market/Popup
2024-07-06,17:00,A discussion on the book 'Brutal Beauty: Aesthetics & Aspiration in Urban India' engages with urban transformations by author Jisha Menon,"BIC, Domlur",Talk
2024-07-06,18:30,"️ A talk on the longest Indus seal script as a trade glossary, shedding light on the language, economics & more with Gopichand Katragadda",Courtyard Koota,Talk
2024-07-06,16:00,‍♀️🚶 A delicious journey through the unique snack culture of Bangalore exploring the history of tiffin eateries & more with Gully Tours,Basavangudi,Other
2024-07-06,17:00,"A day to celebrate chocolates with chocolate making workshop, designing a praline masterpiece & games with Smoor","Smoor, Lavelle Road",Food/Drink
2024-07-06,11:00,"📿🍕 A community market  at Cooke Town  with stalls selling trinkets, clothes, good food & more with Tanya Eldred Bhat",No.58 Lazar road opposite BSNL in Cooke Town.,Food/Drink
2024-07-06,16:30,"☕️ If you’re interested in learning how to pair chocolate & coffee based on your palette, Ketaki & Ashish are hosting","Maverick & Farmer, Koramangala",Food/Drink
2024-07-06,12:00,"If you're interested in learning how to make a moon inspired 3D lamp, artist Payal is hosting","Chapter 6, Koramangala",Workshop
2024-07-06,11:30,"If you are interested in trying out a German themed brunch, Vanessa at Animal Hostel is hosting",Be Animal Hostel,Fitness/Wellness
2024-07-06,12:00,️ A screening & thematic discussion of the acclaimed TV series 'Fleabag' with esteemed writer Gundeep Kaur,"Bira 91 Taproom, Koramangala",Talk
2024-07-06,16:00,"If you're interested in the climate space & exploring the intersection of Climate & AI, Abhishek Raju, Vidya Sridhar & more are hosting","Swissnex, Ashoknagar",Other
2024-07-06,7:30,"‍♀️🚶🌸 If you want to experience Lalbagh through the fragrance of the many exotic flowers that grow there, artist  Abhishek Khan is hosting     Have a great weekend 🌼",Lalbagh,Other
2024-07-08,19:00,"3rd edition of Maahir-e-Pakwan celebrates the diverse flavors from Kathiawar, Kachchh, North, Central & South Gujarat with chef Poonam Dedhia","Hilton Hotels, Manyata",Food/Drink
2024-07-08,19:30,A Kannada adaptation of William Shakespeare's dramedy King Lear,"Ranga Shankara, JP Nagar",Theatre
2024-07-08,20:00,Screening of French director François Truffaut's 1968 comedy 'Stolen Kisses',"Underline Center, Indiranagar",Film Screening
2024-07-08,16:00,"️🖼️ If you're interested in exploring the ongoing Visible/ Invisible exhibit from a fresh perspective, MAP interns Jane & Harlton are hosting","Museum of Art & Photography, Kasturba Road",Art Exhibition
2024-07-08,18:30,️ A discussion of the book about sex trafficking in India 'I Am What I Am' by activist Sunitha Krishnan ,"BIC, Domlur",Talk
2024-07-09,19:00,"If you want to try out a variety of Malabari cuisine, celebrity chef Abida Rasheed is hosting","Citrus, The Leela Palace, Old Airport road",Food/Drink
2024-07-09,11:00,"️ If you're interested in an art exhibit showcasing enriching celebration of artistry & personal expression, artist Preeti Marwaha is hosting",sublime galleria,Art Exhibition
2024-07-09,19:45,‍♀️🚴🧁 A cycle ride through the Indiranagar neighborhood to try out street food or dessert places with Pedal In Tandem,Pedal In Tandem,Food/Drink
2024-07-09,18:30,"️ An exhibition performance exploring the complex ties between memory, self-reflection through various mediums with  Nimi Ravindran & Ben Brix","BIC, Domlur",Art Exhibition
2024-07-09,20:30,"‍♂️🪄 If you're interested in a Harry Potter themed pub quiz, Ace of Pubs are hosting","Communiti, Residency Road",Quiz
2024-07-09,18:30,An exclusive preview screening of director Oz Perkins horror flick,"PVR, Vega City, Banerghatta Road",Film Screening
2024-07-09,19:30,A non- linear Hindi play about 4 women portraying their struggles to break free & calling for a shift in men's perspective    Later in the week:,"Ranga Shankara, JP Nagar",Theatre
2024-07-10,19:00,"🍜 If you want to try warm miso soup or sashimi paying homage to Japanese cuisine, Chef Jerry from The Lotus Oriental is hosting","The Leela Palace, Bharatiya City",Food/Drink
2024-07-10,12:00,"🧆 If you want to binge on  Moroccan vegetable kefta, sea-bass tajine, chicken m’hammer, lamb shank & more with Chefs Jawad Oumerri & Rafia Yassine","The Oberoi, MG Road",Food/Drink
2024-07-10,18:00,"🍹 If you like Bar Takeovers, guest bartender Ishrat Kaur is hosting","BLR Brewing Co., Whitefield",Food/Drink
2024-07-10,18:30,"️ If you're interested in a talk exploring the ties between India & Russia in this current political climate, Venkatesh Varma & more are hosting","BIC, Domlur",Talk
2024-07-10,20:30,"🧐 If you're interested in a nerdy quiz, Ace of Pubs are hosting    Later in the week:","RMZ Ecoworld, Bellandur",Quiz
2024-07-11,19:00,"️ If you're interested in racing gokarts under the lights, RevvHard are hosting   ","Meco Kartopia,  Hennur Bagalur Road",Food/Drink
2024-07-11,18:00,A book celebrating the works of prolific sculptor Meera Mukherjee: 'From the Depth of the Mould' by art historian Tapati Guha-Thakurta,"Museum of Art & Photography, Kasturba Road",Literature
2024-07-11,16:00,"If you want to enjoy refreshing spritzers & sangrias paired with traditional dishes from Lombardy, BG's are hosting",Courtyard by Marriott,Food/Drink
2024-07-11,18:00,"️🌈 An art exhibition representing queerness in art, history & media by artists Aamir Rabbani & Dheeraj Kumar",1 Shanti Road,Art Exhibition
2024-07-11,20:30,"For Ladies interested in a game of Ultimate Frisbee, Team Phoenix are hosting","BBFS, HAL Arena",Fitness/Wellness
2024-07-11,20:00,"If you're interested in a tribute concert to the pop rock group Panic! At the Disco, No Panic, Only Disco are performing","Fandom at Gilly's Redefined, Koramanagla",Music
2024-07-11,19:30,A social drama set during the initial Covid-19 period weaving together a collage of 14 characters revealing biases by director Susanto Banerjee,"BIC, Domlur",Theatre
2024-07-11,14:30,Screening of German director Tomy Wigand's comedy about an outcast student & his peers in a new school,"Max Mueller Bhavan, Indirangar",Film Screening
2024-07-11,20:00,"If you like Indie music, Sweston Collective are performing","Bira 91 Taproom, Koramangala",Music
2024-07-11,18:30,A discussion on two books 'Secularism as Misdirection' & 'Lives of Circumcised and Veiled Women' with Nivedita Menon & Debangana Chatterjee,"BIC, Domlur",Talk
2024-07-11,20:00,"If you like progressive house music: artists Vidur Grover, Jimmy Pé & more are performing     Until tomorrow 👋","Social, Indiranagar",Music
2024-07-12,10:00,"If you're interested in learning the art of classic black & white photography & develop your own film, studio Praxis Techne are hosting","Praxis Technē, Hebbal",Workshop
2024-07-12,16:00,"️ If you want to upcycle the now defunct cassette tapes to make art pieces, artist Madhuri Umashankar is hosting","Bangalore Creative Circus, Yeshwanthapur",Workshop
2024-07-12,9:00,"‍♀️🚶 A heritage walk in an unexplored part of British era market once inhabited by a Persian, drink Sulamani chai & more with Bengaluru By Foot","Johnson market, Richmond Road",Food/Drink
2024-07-12,9:00,"For ladies who are interested in a beginner's Ultimate Frisbee workshop, Nth Adventure are hosting","Tackle, Jayanagar",Fitness/Wellness
2024-07-12,10:00,"🥈 If you're interested in a hands-on workshop to work with silver to nelt, saw, hammer & texture your piece of jewellery, The Workshop are hosting","The Workshop, Horamavu",Workshop
2024-07-12,18:30,"🚶‍♀️🚶 If you're interested in a pub crawl exploring 4 pubs in one evening, BuzzinUp are hosting","Bob's Bar, Kalyanagar",Other
2024-07-12,10:00,"️ A community meetup for Pokemon Go players to explore new places, meet fellow trainers & celebrate with an exclusive adventure",Cubbon Park,Theatre
2024-07-12,19:30,"If you're interested in hip-hop dancing & street / funk dance styles, dancer Samanth is hosting","ARDSIndia, New Tippasandra,",Dance
2024-07-12,11:00,🍶 An exhibition & sale of student artists showcasing pieces they have created during their course at Claystation,"Claystation, Koramangala",Art Exhibition
2024-07-12,11:00,️ A workshop to create art objects by finding artistic potential in everyday waste & delve into the history with artist Arunkumar H G,"Science Gallery, Ganganagar",Workshop
2024-07-12,14:30,"If you're interested in a speed puzzling competition with fellow puzzlers, Playful Pursuits are hosting","Underline Center, Indiranagar",Theatre
2024-07-12,17:00,A discussion on the life of Didi Contractor one of the most formidable architects with author Lakshmi Swaminathan & architect Chitra Vishwanath,"Champaca Book Store, Vasantnagar",Talk
2024-07-12,15:30,Screening of French director Virginie Verrier's biographical sports drama,"Alliance Française, Vasantnagar",Theatre
2024-07-12,18:30,"If you're interested in an afternoon solving puzzles & enjoy screen free time, Playful Pursuits are hosting","Underline Center, Indiranagar",Theatre
2024-07-12,13:00,"📿 An artist collective of a flea market showcasing cute trinkets, handcrafted jewelry & more","Social, Indiranagar",Market/Popup
2024-07-12,11:00,"If you're interested in a flea market to sell & buy cycles, parts & accessories, Crankmeister are hosting ","Crankmeister Bicycle Works, Pulkeshinagar",Market/Popup
2024-07-12,16:00,"If you’re interested in exploring botanical perfumery and try 25+ essential oils to make your own perfume, Kimaya Blends are hosting","SodaBottleOpenerWala, Lavelle Road",Workshop
2024-07-12,20:00,"If you want to listen to African music & Dans Punk: Carissa, Daisho, Fushi, Nich & more are performing     Until tomorrow 👋","Social, Indiranagar",Music
2024-07-13,10:00,"🧑‍🦯 A workshop for the visually impaired to explore art through touch & create tactile art pieces using clay, modeling tools & more with Aishwarya","Museum of Art & Photography, Kasturba Road",Workshop
2024-07-13,9:30,"🪛⛏️ If you're interested in learning to carve a simple teak wood block using traditional hand-forged chisels, Tharangini Studio are hosting","Tharangini Studio, Sadhashivnagar",Workshop
2024-07-13,17:00,"A show combining puppetry, magic & audience interaction with beautifully crafted puppets, a mesmerizing bubble show & more","MLR Convention Center, Whitefield",Theatre
2024-07-13,10:30,"If you want to learn how to make dim sums from scratch, Chef Martin Gomes is hosting  ","Cantan, Lavelle road",Food/Drink
2024-07-13,7:30,"‍♀️🚶🌺 If you’re interested in a fragrance walk & learn about the exotic fruits used to make alcohol in different cultures, Abhishek Khan is hosting",Lalbagh,Fitness/Wellness
2024-07-13,6:30,"‍♀️ A mountain biking workshop teaching essential skills, from body positioning to braking on loose terrain with Pedal In Tandem",Jarakabande Kavalu Butterfly Garden,Fitness/Wellness
2024-07-13,7:30,"👀 If you’re interested in a bird walk near Lalbagh lake, Ulhas Anand is hosting",Lalbagh,Fitness/Wellness
2024-07-13,12:00,"If you’re interested in playing a game of Dungeons & Dragons, ReRoll Board Games are hosting","Underline Center, Indiranagar",Theatre
2024-07-13,16:00,"If you’re interested in making your own cocktails from scratch, mixologist Parinay is hosting","Babylonia, Koramangala",Food/Drink
2024-07-13,12:00,"If you're interested in a pop culture anime party with music, cosplay & more: Anigma are hosting","Social, Church Street",Theatre
2024-07-13,11:00,✍️ A journaling workshop exploring self-expression through creative prompts with Shruti Parthasarathy,"Champaca Book Store, Vasantnagar",Workshop
2024-07-13,11:00,"If you're interested in a Hula Hoop workshop for beginners combined with a workout, Gowri Murthy is hosting ","Bangalore Creative Circus, Yeshwanthapur",Workshop
2024-07-13,12:00,"📚 A meet-up for singles to mingle, design bookmarks, swap books with conversation prompts with Shruti Sah & Radhika Mohta    Have a great weekend ❤️","Muru Muru, Indiranagar",Talk
2024-07-15,20:00,"If you're interested in a quiz themed on the Khans, Ace of Pubs are hosting","Radio Bar, RMZ Ecoworld, Bellandur",Quiz
2024-07-15,20:00,"If you’re interested in playing a social deduction game created by Steven Medway, Now Boarding Cafe are hosting","Now Boarding Cafe, Jayanagar",Theatre
2024-07-15,12:30,"🎏 If you want to try a feast of coastal Goan cuisine, Chef Henzil Saldanha is hosting",MoMo Café - Courtyard by Marriott,Food/Drink
2024-07-15,10:00,"️ If you're interested in an art exhibition to see brass etched enamel painting, artist Dinesh Magar is hosting    Later in the week:","Gallery G, Lavelle Road",Art Exhibition
2024-07-16,12:00,"If you're interested in a Kerala style toddy festival as a spirited homage to the vibrant food culture, Kappa Chakka Kandhari are hosting","Kappa Chakka Kandhari, Koramangala",Food/Drink
2024-07-16,12:00,"If you want to binge on flavours from East & West Bengal, Chef Joyadrita Chatterjee is hosting","CUR8, Four Seasons Hotel",Food/Drink
2024-07-16,20:30,"If you're interested in a Marvel universe themed pub quiz, Ace of Pubs are hosting","Communiti, Residency Road",Quiz
2024-07-16,10:15,A Kannada & Tulu play about the powerful deity Guliga Daiva & promises to enthrall audiences with its compelling narrative with Swaraj Shetty,"Ravindra Kala Kshethra, JC Road",Theatre
2024-07-16,17:00,If you want to uncover the soul of Bangalore with a collection of stories & essays that paint a vivid portrait of Bangalore in a reading circle,"Science Gallery, Ganganagar",Literature
2024-07-16,11:00,"If you're interested in a 2 hour workshop to learn both hand building technique & work on potters wheel, Maya's Pottery are hosting    Later in the week:",Mayas Pottery,Workshop
2024-07-17,17:30,"🎵 If you're interested in a piano recital with percussion performing Vivaldi, Bach, Mozart & more: Natalia, Liav & more are performing ",Natalia’s Piano Studio,Music
2024-07-17,20:30,"If you're interested in 'The Office' themed quiz, Ace of Pubs are hosting","Woodpegger, Manyata Tech Park",Quiz
2024-07-17,21:00,If you want to try the three way spicy Picante tequila creations to celebrate world tequila day by Ishrat Kaur,one8 commune,Food/Drink
2024-07-17,18:30,️ A talk by journalist T Ramakrishnan on his book 'Cauvery: A Long Winded Dispute' exploring the history of the Cauvery water dispute,"BIC, Domlur",Talk
2024-07-17,18:30,"If you like Death Metal music Defeated Sanity, Godless & Xrepeatx are performing","Fandom at Gilly's Redefined, Koramanagla",Music
2024-07-17,17:00,"🧬 If you're interested in a workshop on 'Science of Cooking' through hands on experiments to make science relatable & enjoyable, Parsec are hosting","Parsec, Jayanagar",Workshop
2024-07-17,10:30,🥼 A workshop on physics for teachers to learn about electricity with JNP    Later in the week:,"Jawaharlal Nehru Planetarium, Sankey Road",Workshop
2024-07-18,12:00,A pop up to try Hakka cuisine with a unique Indian twist embodying cultural fusion with Chef Katherine Lim,"Mikusu, Conrad",Food/Drink
2024-07-18,18:00,"☕️ If you're interested in learning about the history, culture & traditions of tea & how to make it the right way: Tea sommelier Susmita Das is hosting","Yauatcha, MG Road",Food/Drink
2024-07-18,16:00,"️ If you're interested in a curated walk to discover artworks with unique genres & mediums, artists Jai Khanna, Dinesh Magar & more are hosting","Gallery G, Lavelle Road",Fitness/Wellness
2024-07-18,20:00,"If you like progressive metal sounds, artist Sutej Singh is performing","Fandom at Gilly's Redefined, Koramanagla",Music
2024-07-18,19:30,"If you want to try authentic Coorgi food, Chef Priya is hosting the Epicurious Table","Salt & Pepper Kitchen, Primrose Road",Food/Drink
2024-07-18,19:30,"Screening of Chao Carbon, Wrought, Wade & more exploring environmental resilience, decay & the human impact on the natural world","Atta Galatta, Indiranagar",Film Screening
2024-07-18,20:30,"If you like Indie pop music, artist Vasu Raina is performing","Bira 91 Taproom, Koramangala",Music
2024-07-18,11:00,"‍💻 If you're looking at working from a new space to clear your head & backlog, Underline Center are hosting","Underline Center, Indiranagar",Other
2024-07-18,18:00,Screening of 7 short films showcasing stories of Indigenous & knowledge from remote regions of Australia,"Science Gallery, Ganganagar",Film Screening
2024-07-18,20:00,If you're interested in listening to music on Vinyl: DJ's Tuhin Mehta & Vachan Chinnappa are performing,"Social, Indiranagar",Music
2024-07-18,22:00,️ Screening of Studio Ghibli director Hayao Miyazaki's animated fantasy 'The Boy And The Heron'    Until tomorrow 👋,"Neon Market, Indiranagar",Film Screening
2024-07-19,10:00,"️🔡 If you want to print a poster with your fave quote or poem with a typographic layout & using types, Chase the Key are hosting","Chase The Key Letterpress India, Bommanahalli",Workshop
2024-07-19,16:00,"If you’re interested in a sushi rolling workshop and understand the brief history of the cuisine, The White Box are hosting","Edo, ITC Gardenia",Workshop
2024-07-19,15:30,"A philosophical comedy about two actors set in the afterlife, exploring their pasts, their love for the stage & their idol Naseeruddin Shah","Jagriti Theatre, Whitefield",Theatre
2024-07-19,19:00,"🍛 If you’re interested in trying Khasi cuisine from Meghalaya, Chef Benson Isaac from Mei Mei Kitchen are hosting",Courtyard Koota,Food/Drink
2024-07-19,18:00,🚶‍♀️🚶 A tipsy bar crawl to visit dive bars & pubs in & near Tippsaandra & learn about the underground rock music scene with Gully Tours,Tippasandra,Music
2024-07-19,20:00,"If you like Indie rock music, Meewakching are performing","Bira 91 Taproom, Koramangala",Music
2024-07-19,11:00,️ A Candle crafting workshop with a few mindfulness workshops with artist Krypa,"Blue Tokai, HSR",Workshop
2024-07-19,17:30,"‍♀️🧘🕯️ If you want to try Yin yoga: a quiet contemplative practice by the candlelight, Yoga practitioner Franzi is hosting ",Copper + Cloves Studio,Theatre
2024-07-19,18:00,"🪶 If you're interested in a fun alcohol-themed quiz, QM Sanket is hosting","Deck of Brews, Kadubeesanahalli",Quiz
2024-07-19,15:00,"If you're interested in a crochet knitting meetup, crocheter Priyanka is hosting",Kodihalli,Meetup/Social
2024-07-19,16:00,"If you like Electronic Dance Music, The Yellowheads are performing","Gylt, Hennur",Music
2024-07-19,16:00,"If you’re interested in exploring botanical perfumery and try 25+ essential oils to make your own perfume, Kimaya Blends are hosting","The Fat Chef, Whitefield",Workshop
2024-07-19,21:00,"If you like a tribute concert to Coldplay, Kishan Balaji Collective are performing","Fandom at Gilly's Redefined, Koramanagla",Theatre
2024-07-19,19:30,"An homage to Anton Chekov’s short stories, the play is a 4 part series that exposes the frailty of humans written by Neil Simon",Shankaraa Foundation,Theatre
2024-07-19,16:30,Screening of Persian documentary Seven Winters in Tehran by German director Steffi Niederzoll,"Max Mueller Bhavan, Indirangar",Film Screening
2024-07-19,17:00,"3️⃣🖨️ An open house to explore the latest projects, products & the amazing tools like their 3D printer, vinyl cutters & more with Paper Crane Lab","Paper Crane Lab, Indiranagar",Other
2024-07-19,12:00,️ Screening of Taiwanese director's Chen Kun-hou & Wan Jen's drama 'Grown Up' & 'Super Citizen Ko'    Until tomorrow 👋,"Dialogues Cafe, JP Nagar",Theatre
2024-07-20,18:00,"🎵 If you want to listen to traditional & contemporary tunes played on bamboo instruments, Vayali are performing",Courtyard Koota,Theatre
2024-07-20,15:00,An illustrated lecture & a poster exhibition on moon with BR Guruprasad,"Jawaharlal Nehru Planetarium, Sankey Road",Art Exhibition
2024-07-20,12:00,"🍷 If you're interested in a pizza & wine party, Crab Culture are hosting","23rd Street Pizza, Castle Street",Food/Drink
2024-07-20,14:30,"Screening of director Kim Do-Young's drama Kim Jiyoung, Born 1982","Starbucks, Bangalore",Theatre
2024-07-20,7:30,"🚶‍♀️🚶 A tree appreciation walk exploring the rich diversity of Cubbon Park to learn to identify trees, edible plants & more with Gowri",Cubbon Park,Fitness/Wellness
2024-07-20,15:00,"If you want to plan a fun day out with your feline with games, buffet & more, Pet Fed are hosting  (Gully Coffee Roasters, Koramangala - 03:00 PM)","s) with games, buffet & more, Pet Fed are hosting https://bit.ly/46ag8pt (Gully Coffee Roasters, Koramangala",Food/Drink
2024-07-20,8:30,"🥕 If you’re interested in procuring fresh produce from a farmers market, LVBL & Akshaya Kalpa are hosting","The Finer Side, Off Kanakapura Road",Market/Popup
2024-07-20,20:00,"🎼 If you like alternative rock: Fallen Letters, Screetus & Radio Magazine are performing","Fandom at Gilly's Redefined, Koramanagla",Music
2024-07-20,16:00,A play with relatable themes & humorous characters to confront biases & discover true meaning of love & acceptance,"BIC, Domlur",Theatre
2024-07-20,10:00,"‍🦯🖼️ A workshop for the visually impaired to explore art through touch & create tactile art pieces using clay, modeling tools & more with Aishwarya","Museum of Art & Photography, Kasturba Road",Workshop
2024-07-20,10:00,"🪛 If you want to learn to work with reed bamboo & create, artist Rajeev Wind is hosting",Courtyard Koota,Workshop
2024-07-20,18:30,"️ Live screening of Hungarian Grand Prix with beer bucket, chicken wings, contests & more at RCB Bar & Cafe ","RCB Bar and Café, Ashoknagar",Workshop
2024-07-20,18:30,"If you’re interested in a live communal screening of Hungarian Grand Prix, Skydeck are hosting  ","SkyDeck by Sherlock's, Ashoknagar",Workshop
2024-07-20,16:00,"A day in the park reading, painting, listening to live music performance & more to celebrate the parks of Bangalore","Swabhiman Park, Sector 4, HSR",Meetup/Social
