date,time,description,location,category
2024-09-27,18:00,"👩‍🦰 If you're interested in a meetup for parents of Indie dogs to relax, discuss & watch the Indie Dog Movie Screening: HUFT are hosting",Heads Up For Tails Pet Store & Spa - 1st Block Koromangala,Film Screening
2024-09-27,14:30,️ A talk exploring the seismic activity of Karnataka with renowned geophysicist Kusala Rajendran,"Science Gallery, Ganganagar",Talk
2024-09-27,11:50,️ Screening of director Fritz Lang German expressionist science-fiction silent film    Until tomorrow 👋,"Casa Karaoke, JP Nagar",Film Screening
2024-09-28,11:30,A hands-on session to create your an unique print inspired by the exhibition 'Rhyme Unbroken' using technique of collagraph printmaking,"Museum of Art & Photography, Kasturba Road",Workshop
2024-09-28,10:00,️‍♀️ A bungee fitness workout that will have you flying high while toning your muscles & recharge with healthy bites with Jamberry Experiences,"Aura Yoga And Dance Studio, HSR Layout",Fitness/Wellness
2024-09-28,9:00,"🍳 An ultimate breakfast experience with our seasonal super fruit offerings, uniquely infused to create signature dishes with The Cubbon Tale","Trippy Goat, Cunningham Road",Food/Drink
2024-09-28,19:00,"If you like Uk Garage, DnB & Bass House: NRJ, XAN & more are performing","Social, Indiranagar",Music
2024-09-28,19:30,A powerful musical in Marathi & Kannada celebrating India’s diverse musical culture & inspiring a new narrative of freedom & resilience,"Ranga Shankara, JP Nagar",Music
2024-09-28,15:30,The play is a take on Roald Dahl’s Lamb to the Slaughter which highlights victim shaming and biases in our society,Medai- The Stage,Theatre
2024-09-28,11:00,"If you're looking to adopt a fur baby, C + C are hosting a puppy adopton drive    ","Copper + Cloves, Indiranagar",Other
2024-09-28,12:00,A discussion on the book 'The Book of Emperors' an illustrated book on Mughal emperors with authors Ashwitha Jayakumar & Nikhil Gulati,"Champaca Book Store, Vasantnagar",Talk
2024-09-28,6:30,"🚵‍♀️ If you’re interested in a countryside bike ride in and around Hennur, Pedal in Tandem are hosting",Snoopy Paws Cafe,Fitness/Wellness
2024-09-28,11:00,"️ Join us for a discussion on the history & production of sugar, exploring its connections to intergenerational trauma, geographical identities & more",Courtyard Koota,Talk
2024-09-28,6:00,"‍♀️🏃‍♂️ If you're interested in a beginner friendly run, Bhaago India are hosting","Kittur rani chennamma stadium, Jayanagar",Fitness/Wellness
2024-09-28,14:00,🕯️ If you want to create a Beer candle from scratch & indulge in some beer & mocktails: House of Drip  are hosting,"Biergarten, Bellandur",Food/Drink
2024-09-28,9:30,"️ A talk delving into Bengaluru’s congested roads & strategies to maximize resources & transition towards a cleaner, greener future with Tarun Rambha  ","Science Gallery, Ganganagar",Talk
2024-09-28,16:00,‍🏫🛰️ If you're interested in a lecture on the 10th Anniversary of 'Mangalyaan' reaching its desired orbit around Mars: JNP are hosting,"Jawaharlal Nehru Planetarium, Sankey Road",Talk
2024-09-28,9:00,"🧘‍♀️ If you're interested in an Animal Flow workshop, instructor Akshay is hosting","Troop HQ, Domlur",Workshop
2024-09-28,12:30,"🍷🎵 A mix of house, disco & afro beats curated by artists Vidur Grover & Ira bb alongside unlimited New York style pizzas & wines    Have a great weekend ♥️","23rd Street Pizza, Castle Street",Food/Drink
2024-09-30,18:30,Screening of director Jean-Luc Godard's romcom at Maraa,"Maraa Collective, Indiranagar",Film Screening
2024-09-30,17:30,"🗾 If you want to learn resin, mixing ratios, tools & techniques to create a Koi Fish Pond, Story Zone are hosting  ","Story Zone Studio, HSR",Workshop
2024-09-30,12:00,📷 A wildlife photography exhibition showcasing artist Michael Swamy’s works giving voice to the wild's transient beauty,Maya,Art Exhibition
2024-10-01,11:00,"🥻 A gathering to highlight the cultural significance of slow, hand-done processes that breathe life into textiles with Art In Transit",Cubbon Park,Meetup/Social
2024-10-01,7:00,"‍♀️🚶 If you're interested in a walkathon, Karnataka Forest Department are hosting",Cubbon Park,Fitness/Wellness
2024-10-01,18:30,"If you like dance theatre performance in the form of Bharathantyam, Vaibhav Arekar is performing",Medai- The Stage,Theatre
2024-10-01,11:00,📿 If you're interested in shopping for handmade stuff for Diwali: A Hundred Hands are hosting,Jayamahal Palace Hotel,Market/Popup
2024-10-01,11:00,If you want to try authentic Odia food from the region of Utkal: Chef Saipriya is hosting,The Park,Food/Drink
2024-10-01,19:00,"A play about a prison inmate as both observer & subject, he shares his thoughts, dreams & insights, weaving a tapestry of stories & commentaries","Our Theatre Collective, Koramangala",Theatre
2024-10-01,11:00,"If you're interested in a jigsaw puzzle solving competiton, Playful Pursuits are hosting  ","Underline Center, Indiranagar",Theatre
2024-10-02,19:30,If you want to taste a curated selection of wines from around the world: Nikhil Agarwal is hosting,"Trippy Goat, Cunningham Road",Food/Drink
2024-10-02,11:00,"🇮🇳 If you want to see an inspiring tribute featuring the Constitution-themed Doll collection, NGMA are hosting",NGMA,Art Exhibition
2024-10-02,16:00,An engaging panel discussion & podcast listening experience highlighting the unique relationship between people & nature  ,"BIC, Domlur",Talk
2024-10-02,17:00,If you want to make 4 styles of candle for Diwali: Paint Cafe Studio are hosting,"Paint Cafe Studio, Whitefield",Workshop
2024-10-02,17:45,"If you like classical music played on flute, renowned artist Vidwan H.S. Venugopal is performing","Yuvapatha, 4th Block, Jayanagar",Music
2024-10-02,19:30,"A play navigates love, ambition & aging, lives becoming entangled, leading to heartbreak & disillusionment, based on a Russian play","Ranga Shankara, JP Nagar",Theatre
2024-10-03,21:30,"If you like  a unique blend of R&B, soul & jazz influences: Swiss artist Nnavy is performing",Windmills,Music
2024-10-03,11:00,"🦮 If you want to weave a strap or a dog collar using the Inkle weaving method, Shuttles & Needles are hosting","Shuttles & Needles, Bangalore",Workshop
2024-10-03,11:30,"🌱 If you're interested in thrifting, Zemyna Foundation is hosting",Jinvara,Market/Popup
2024-10-03,16:00,A play explores the lives of women imprisoned in one of the Nazi regime's most notorious concentration camps set in the  backdrop of World War II,Kalagrama,Theatre
2024-10-03,10:30,️🛰️ If you're interested in a talk about Gaganyaan - an Indian crewed orbital spacecraft - Hanamantray Baluragi is hosting,"Jawaharlal Nehru Planetarium, Sankey Road",Workshop
2024-10-03,18:30,"️ An illustrated talk bringing remarkable stories & inspiring locales about sculptors to life, highlighting the beauty of our architectural heritage","BIC, Domlur",Talk
2024-10-03,18:00,If you're interested in the popular card game of - Magic: The Gathering meetup - Reroll Boardgames are hosting,"Underline Center, Indiranagar",Meetup/Social
2024-10-03,16:00,"If you like electropop house music, DJ Alan Walker is performing","Nice Grounds, Tumkur Main Road",Music
2024-10-03,20:00,If you like indie pop music Stringy-Cheese & CrackerJack are performing,"Bira 91 Taproom, Koramangala",Music
2024-10-03,14:30,️ Screening of director Florian Henckel von Donnersmarck 's documentary drama    Until tomorrow 👋,"Max Mueller Bhavan, Indirangar",Theatre
2024-10-04,12:00,"🏎️ If you're interested to try a F1 style simulator, Titan World are hosting","Titan World, Indiranagar",Other
2024-10-04,12:00,"👗📿 A day to engage with art in a fresh & dynamic way with electronic music & more with Entente.fm, Say Less & Soul Kollektiv",Jinvara,Music
2024-10-04,17:00,"If you want to listen to folk percussion music from Rajasthan and Kerala, Beat Route are performing","Chowdiah Memorial Hall, Malleswaram",Music
2024-10-04,19:00,"A play reading based on the life of renowned poet Kaifi Azmi & his beloved wife, Shaukat Kaifi with actors Shabana Azmi & Kanwaljit Singh","Dr. BR Ambedkar Bhavan, Millers Road",Theatre
2024-10-04,16:00,"️ If you want to create an organic cotton tote with tie-dye method using natural dyes, House of Stories are hosting","House of Stories, Indiranagar",Workshop
2024-10-04,11:00,"If you want to learn to make & toss pancakes, Krust Cafe are hosting","Krust Cafe, Koramangala",Food/Drink
2024-10-04,20:00,If you like electronic dance music: Swedish DJ Diorange is performing,"Secret Story Bar & Kitchen, Indiranagar",Music
2024-10-04,19:00,"‍🎤🏳️‍🌈 If you like a blend of disco, riot grrrl rock, house music & Gaana music: Trans artists Kinari & Gaana Vimala are performing","Shoonya - Centre for Art and Somatic Practices, Lalbagh Main Road",Music
2024-10-04,12:00,"If you want to pamper your tastebuds with special menus, tasting workshops & buy cheese: Bombay Fromagerie are hosting","Trippy Goat, Cunningham Road",Workshop
2024-10-04,21:00,🦮 If you're interested in watching a show for champion dogs: Bangalore Canine Club are hosting,Hebbal Veterinary College Grounds,Other
2024-10-04,15:00,‍💻 A transformative workshop aimed at challenging & changing the visual discourse around sexual violence against women in South Asia,"Museum of Art & Photography, Kasturba Road",Workshop
2024-10-04,9:00,"️ A comprehensive filmmaking workshop covering the 3 essential stages: Pre-Production, Production & Post-Production with Aakash Prabhakar","NeeRav Arts Village,Bidadi",Workshop
2024-10-04,11:00,"🔧 If you’re interested in learning the basics of home maintenance & roadside repair of bikes, Pedal in Tandem are hosting",Pedal In Tandem,Fitness/Wellness
2024-10-04,13:30,️ Screening of director Siddharth Chauhan's award winning short films: The Infinite Space & Pashi,"Qutum Studio, Domlur",Film Screening
2024-10-04,14:00,️ If you're interested in a Foosball showdown: K-OS The Gamebar are hosting,"K-OS The GameBar, Koramanagala",Other
2024-10-04,18:30,"️ A discussion exploring the act of design, highlighting the essential connections between an architect's profession & the experiences of everyday life","BIC, Domlur",Talk
2024-10-04,20:00,"If you like indie rock, One Girl Shy are performing","Fandom at Gilly's Redefined, Koramanagla",Music
2024-10-04,15:30,"️🪑 If you’re interested in converting scrap wood into a beautiful rustic vintage home decor, Art Delight are hosting    Until tomorrow 👋","ArtDelight Group, Harlur",Workshop
2024-10-05,16:00,A fast paced comedy placing beloved figures from Shakespearean characters in absurd predicaments that clash with modern sensibilities,"Artkhoj, JP Nagar",Other
2024-10-05,7:30,"‍♀️🚶 If you’re interested in a Sunday walk exploring Koramangala’s natural beauty, people and history: Ashish, Ramya & Febin are hosting",Koramangala 3rd Block,Fitness/Wellness
2024-10-05,9:00,🧇 An English breakfast popup with a Goan twist by Chef Rhea Aaron,"Klaa Kitchen, Indiranagar",Market/Popup
2024-10-05,14:00,Screening of director Bong Joon-ho's horror movie 'The Host',"Starbucks, Bangalore",Film Screening
2024-10-05,14:00,"If you're interested in a jigsaw puzzle solving hangout, Playful Pursuits are hosting",Courtyard Koota,Theatre
2024-10-05,21:00,"If you like indie pop music, artist Shalmali Kholgade, guitarist Royce Fernandes & more are performing","Fandom at Gilly's Redefined, Koramanagla",Music
2024-10-05,11:30,"✍️ If you want to create postcards with doodles, artist Pratiksha Gupta is hosting","Teavaro - Global Brewhouse, Koramanagala",Other
2024-10-05,18:00,A Halloween experience in an improv murder mystery theme with Yours Truly Theater,"Yours Truly Theatre, Indiranagar",Other
2024-10-05,16:00,"If you're interested in a traditional Parai & Tamate performance, Adavi Arts Collective, Minchu Arts Collective & more are performing","Ravindra Kala Kshethra, JC Road",Theatre
2024-10-05,10:00,"🪚 If you’re interested in a beginner friendly woodworking workshop, The Workshop are hosting ","The Workshop, Horamavu",Workshop
2024-10-05,6:00,"🚵‍♀️ If you’re interested in a bicycle ride in and around Nandi Hills, Pedal in Tandem are hosting","Tribal Cafe, Nandi Hills Road",Fitness/Wellness
2024-10-05,18:00,A discussion on the book about the Aadhar project and its cultural & societal influences with author Rahul Bhatia  ,"BIC, Domlur",Talk
2024-10-05,16:00,"🎵 If you’re interested in a day party gathering alongside BBQ & grills, Somad are hosting","7 Rivers Brewing Company, Taj , MG Road",Meetup/Social
2024-10-05,15:30,A set of plays exploring the power of stories in our fast-paced world & the importance of holding onto our urban fairytales,"BIC, Domlur",Theatre
2024-10-05,15:00,"If you're interested in a beginner friendly Dapostar, Hula Hoop & Poi workshop: Freeflow are hosting","Breathing Spaces, Vasanth Nagar",Workshop
2024-10-05,13:00,"If you like boardgames, Not So Board are hosting    Have a great weekend ahead ❤️","Sunny Side Bistro, Cooke Town",Other
2024-10-07,15:00,If you want to learn more about Dasara dolls during the ongoing Dasara festivities in old parts of Bangalore - Bengaluru by Foot are hosting,Basavangudi,Other
2024-10-07,18:30,"If you’re interested in a Shopping Spree themed social puzzle solving hangout, Puzzled Pint are hosting","Bohemians, Indiranagar",Meetup/Social
2024-10-07,10:00,If you're interested in a pop up to buy Indian wear: Shades of India are hosting  ,Raintree,Market/Popup
2024-10-07,19:00,"If you're interested in a board game night, Cafe Plume are hosting    Until tomorrow 👋","Cafe Plume, Indiranagar",Other
2024-10-08,19:00,"A play about a woman’s struggles & how her actions sparks questions about gender, tradition & the place of women in public rituals","BIC, Domlur",Theatre
2024-10-08,17:00,"🏺 If you're interested in a pottery workshop to create something with your hands, potter Maya Babu is hosting","Namma Ashram, Whitefield",Workshop
2024-10-08,18:30,Screening of director Govind Nihalani's legal drama    Until tomorrow 👋,"Maraa Collective, Indiranagar",Theatre
2024-10-09,19:00,If you're interested in a game of Badminton to relive your childhood: Pedal In Tandem are hosting,"Game Theory, Indiranagar",Fitness/Wellness
2024-10-09,19:00,"If you're interested in a solo Bharatanatyam performance, dancer Ananya Shanbhag is performing",Medai- The Stage,Theatre
2024-10-09,18:00,"An inter-generational conversation with women, seeking a room of their own.","Maraa Collective, Indiranagar",Talk
2024-10-09,19:30,"A play emphasizing the wisdom that true sustenance comes from the earth & its people, not from material wealth   ","Ranga Shankara, JP Nagar",Theatre
2024-10-09,17:00,📸 A wildlife photography exhibition through the lens of acclaimed photographer M.N. Jayakumar,"Conrad, Halasuru",Art Exhibition
2024-10-09,19:45,"🕺 If you're interested in a beginner friendly salsa class, Shara are hosting",Copper + Cloves Studio,Workshop
2024-10-09,18:30,🧠❤️‍🩹 Screening of director Neeraj Ghaywan's short film on mental health 'Pucchi'    Until tomorrow 👋,"BIC, Domlur",Film Screening
2024-10-10,21:30,If you like jazz: the quintet from MoonMot are performing,Windmills,Music
2024-10-10,19:00,A play where the protagonist invites a larger conversation around depression & the profound impact it has on both individuals & their loved one,"SMART Studio, Ulsoor",Talk
2024-10-10,19:00,"If you like a Fusion of Pop, Rock & Flamenco music: Chizai are performing","Bira 91 Taproom, Koramangala",Music
2024-10-10,20:00,"An immersive musical journey of a fusion of live jazz, club culture & electronic sounds with ZFEX    Until tomorrow 👋","Fandom at Gilly's Redefined, Koramanagla",Music
2024-10-11,15:00,"️ If you want to learn crackle method of painting & make a MDF table organiser, Itsy Bitsy are hosting","Itsy Bitsy, HSR Layout",Workshop
2024-10-11,11:00,"If you want to curate pizzas with choices of sauces & toppings, Krust Cafe are hosting","Krust Cafe, Koramangala",Food/Drink
2024-10-11,15:00,"A slapstick comedic play about a charismatic man leading a secret double life who becomes a local hero by accident, leading to hilarious chaos","Alliance Française, Vasantnagar",Theatre
2024-10-11,9:30,️ An engaging workshop designed for young adults & renters on how to make a home more energy-efficient with IIHS,"Science Gallery, Ganganagar",Workshop
2024-10-11,8:00,‍♂️🚶‍♀️ A guided walk through a lush landscape with majestic heirloom trees & rare plant species from around the world with Bangalore Local Walks,Lalbagh,Fitness/Wellness
2024-10-11,19:00,A play about a girl & discovery of her dad's notebook leads to a haunting question: how much of her father’s genius—or his madness—has she inherited?,"Vyoma Artspace and Studio Theatre, JP Nagar",Theatre
2024-10-11,19:30,If you want to listen to electrifying tribal rhythms & modern beats: HilightTribe are performing,"Sunburn Union, Koramangala",Music
2024-10-11,13:00,️ An interactive workshop on leveraging geospatial technologies to engage with public issues with IIHS,"Science Gallery, Ganganagar",Workshop
2024-10-11,19:00,"If you like Techno, Bulgarian DJ Bultech is performing","Pebble, Bellary Road",Music
2024-10-11,10:00,"A chance to dive into the world of traditional typesetting, composting metal type & understanding the intricate process behind letterpress printing","Chase The Key Letterpress India, Bommanahalli",Music
2024-10-11,13:00,"If you're interested in the ancient Chinese healing practice of Acupunture, HeyBrewty are hosting","HeyBrewty, Ashok Nagar",Other
2024-10-11,13:00,"If you like boardgames, Not So Board are hosting","Sunny Side Bistro, Cooke Town",Other
2024-10-11,10:30,"‍♀️ If you want to unlock new creative possibilities blending theatre & contemporary movements, LUMO are hosting    Until tomorrow 👋","Red Brick Studio, Indiranagar",Theatre
2024-10-12,11:00,"A pan Asian-inspired menu consisting roasted aubergine banh mi, pan seared tofu gyoza & more by Chef Sejal   ","Copper + Cloves, Indiranagar",Food/Drink
2024-10-12,10:30,🥘 Explore the rich heritage of forgotten foods & reconnect with ingredients & recipes from the past in a sustainable way,"Akshayakalpa Agriculture Research and Development Facility, Tiptur District, Hassan",Food/Drink
2024-10-12,10:00,"️ An engaging workshop to dive into the question of Bengaluru's future drawing from history, art & more with facilitators Siddhi and Kushal ","BIC, Domlur",Workshop
2024-10-12,19:30,"A play with 3 distinct stories integrated into one presentation, offering audiences a rich tapestry of voices, emotions & experiences","Ranga Shankara, JP Nagar",Theatre
2024-10-12,19:00,A play offering a poignant reflection on the fragility of life & the transformative lessons one can learn when faced with mortality,Indian Institute of World Culture Gallery,Theatre
2024-10-12,6:00,"‍♂️ If you’re interested in a bicycle ride in and around the pretty countryside of Hesaraghatta & Doddabalapur, Pedal in Tandem are hosting",SLBTC Lake End Circle,Fitness/Wellness
2024-10-12,7:30,"🦆 If you're interested in a morning bird watching walk at Lalbagh, BNG Birds are hosting",Lalbagh,Fitness/Wellness
2024-10-12,15:00,"If you're interested in a board gaming event with 100+ rare and interesting games collected from all over the world, Board Busters are hosting","Bangalore Creative Circus, Yeshwanthapur",Other
2024-10-12,15:00,"✍️ If you're interested in a workshop to  introduce & inculcate journaling as a habit, writer Shruti Parthasarathy is hosting","Bangalore Creative Circus, Yeshwanthapur",Workshop
2024-10-12,10:30,"If you want to learn how to make dim sums from scratch, Chef Martin Gomes is hosting","Cantan, Lavelle road",Food/Drink
2024-10-12,10:00,"If you're interested in a Pickelball meetup curated for singles, Bangit Sports are hosting","Coolulu Turfpark, Koramangala",Meetup/Social
2024-10-12,13:00,Screening of director Makoto Shinkai's animated romantic fantasy,"Starbucks, Bangalore",Film Screening
2024-10-12,17:00,"If you're looking for a perfect blend of live acoustic sounds, delicious coffee & laid-back weekend vibes, Theodore Dsouza & Yudhvir are performing    Have a great weekend ❤️","Starbucks, Indiranagar",Music
2024-10-14,19:40,"Screening of director Mani Kaul's Yatrik, Arrival & Before My Eyes of temporal medium cinema","Underline Center, Indiranagar",Film Screening
2024-10-14,11:00,"️🦢🎆 If you're interested in a pop up for Diwali shopping, Roligami & Bliss Pop Up are hosting","RMZ Ecoworld, Bellandur",Market/Popup
2024-10-14,19:30,"A play written by 8th-century Sanskrit dramatist Bhavabhuti, about a romantic drama set against the backdrop of political intrigue & social unrest","Ranga Shankara, JP Nagar",Theatre
2024-10-14,12:00,"If you're interested in a floral jewellery making workshop by learning basics of resin, using UV resin & relevant tools: StoryZone are hosting    Until tomorrow 👋","Story Zone Studio, HSR",Workshop
2024-10-15,19:30,"If you like bar takeovers, mixologist Yasuhiro from Punch Room, Tokyo is hosting","ZLB 23, The Leela Palace",Food/Drink
2024-10-15,18:30,Screening of French filmmaker Céline Sciamma’s debut coming of age story,"Maraa Collective, Indiranagar",Film Screening
2024-10-15,9:30,"If you want to see Kiwis clash with Team India in a test match format, there’s","M. Chinnaswamy Stadium, MG Road",Other
2024-10-15,17:00,"An adaptation of G.K. Chesterton's classic novel with a comic noir aesthetic, by emerging actors from Christ college","Christ University, Hosur Main Road",Theatre
2024-10-15,18:30,"If you're interested in an immersive script reading session of Sci-fi movie 'The Man From Earth', SanimaWaale are hosting    Until tomorrow 👋","Qutum Studio, Domlur",Film Screening
2024-10-16,11:00,"📿 If you want to support the legacy of artisans this festive season with 'Aaram', Tilonia Bazaar are hosting","BIC, Domlur",Market/Popup
2024-10-16,18:30,🫳 A hands on workshop to craft quirky characters with clay & weave unique stories by potter Rucha Dhayarkar,"Ladyfingersco., 8th Edifice, Indiranagar",Workshop
2024-10-16,19:00,"️ If you're interested in an art exhibition incorporating nature- as symbols of peaceful coexistence, trans artist Rumi Harish is hosting",1 Shanti Road,Art Exhibition
2024-10-16,19:15,"If you're interested in a beginner friendly salsa class, Shara are hosting",Copper + Cloves Studio,Workshop
2024-10-16,19:30,"If you're interested in a classical dance performance of Kathak, dancer Aishwarya Verma is performing",Medai- The Stage,Dance
2024-10-16,6:00,‍♀️🏃‍♂️ A beginner friendly run with strenght training by Adidas Runner’s HSR chapter,HSR Stadium,Fitness/Wellness
2024-10-16,6:00,‍♀️🏃‍♂️ A beginner friendly mobility & speed session run with Adidas Runner’s Indiranagar chapter    Until tomorrow 👋,"Adidas Store, Indiranagar",Fitness/Wellness
2024-10-17,17:00,"If you want to watch a solo performance of Bach, Beethoven, Rachmaninoff, Chopin, Brahms, Liszt & more, Pianist Neil Sajnani is performing","Aruna Sunderlal Auditorium, The BSM.",Theatre
2024-10-17,19:30,"If you like bar takeovers, mixologists Shubham & Pratik from Sidecar, New Delhi  are hosting  (Muro - 07:30 PM)",Ranked No. 26 spot in the World & No.18 in Asia Best Bars List) are hosting https://bit.ly/3Ae27vb (Muro,Food/Drink
2024-10-17,19:00,"If you want to taste a curated 9 course modern Spanish Tasting menu with delicious tapas, Paella & Tiramusu, Chef Manuel Olveira is hosting","JW Marriott Hotel, Shantalanagar",Food/Drink
2024-10-17,19:00,"If you're interested in a contemporary dance performance, artists Sahiba Singh, Dayanand Akhilesh & Dinesh Kumar are performing ",Medai- The Stage,Theatre
2024-10-17,18:00,"If you like Indie hip hop, duo from 'Seedha Maut' Siddhant Sharma & Abhijay Negi are performing","Forum, South Bangalore",Dance
2024-10-17,17:30,️ An art exhibit with 7 series of drawings focusing on the female experience expressed through varied media with artist Shakuntala Kulkarni   ,Gallery Sumukha,Art Exhibition
2024-10-17,19:30,"If you're interested in a classical dance performance of Kathak, students of Aditya Sharma are performing","BIC, Domlur",Dance
2024-10-17,22:00,"If you want to enjoy a night with killer wines & laid back vibes with 90's music, Somm Prithvi Nagpal is hosting  ","23rd Street Pizza, Castle Street",Music
2024-10-17,11:00,"🧥 If you're interested in a mindful shopping experience exploring a curated sustinable collection, Our Better Planet are hosting",Raintree,Market/Popup
2024-10-17,19:00,"A play set in 10th Century BC exploring themes of power, duty & personal suffering, because of the complex societal norms that dictated the lives in that era    Until tomorrow 👋","Seva Sadan, Malleswaram",Theatre
2024-10-18,17:00,🎻 An evening featuring diverse compositions with different instrument performed by German composers with BSM,"Aruna Sunderlal Auditorium, The BSM.",Music
2024-10-18,11:00,🥒🗣️ A unique workshop using food as a medium to unlock & share personal stories to explore narratives through a culinary lens with Vamsi Matta,"345, Cooke Town",Workshop
2024-10-18,17:00,"️ A discussion with design disruptors in the 3 top polluting industries worldwide- construction, personal wear & personal transport with Jenny Pinto","The Purple Turtles, Indiranagar",Talk
2024-10-18,19:00,"If you're interested in a pop up to try Brazilian cuisine straight from Rio, Lasai are hosting","Le Cirque Signature, The Leela Palace",Food/Drink
